{
  "schema_version": "1.1",
  "signal_id": "tic-457728881-s01",
  "assessed_utc": "2026-10-16T14:21:15.306414Z",
  "progress": {
    "stage": "source_vetting",
    "stages": {
      "screening": "partial",
      "source_vetting": "partial",
      "physical_vetting": "not_started",
      "followup": "not_started",
      "validation": "not_started",
      "confirmation": "not_started"
    }
  },
  "scientific_assessment": {
    "status": "unclassified",
    "planet_probability": null,
    "basis": "Fresh signed diagnostics and aperture centroid checks; physical host, timing qualification and planetary interpretation remain unresolved.",
    "review_evidence": []
  },
  "initial_screen": {
    "outcome": "incomplete",
    "all_checks_available": false
  },
  "warnings": [],
  "open_requirements": [
    "calibrated_source_attribution",
    "timing_consistency",
    "qualified_physical_scenarios",
    "astrophysical_FPP_NFPP",
    "full_search_reliability",
    "scientific_classification_review",
    "complete_binary_variable_catalogue_coverage"
  ],
  "evidence": [
    {
      "path": "evidence/vetting-findings.json",
      "sha256": "835f325215d5d5580f36e851e14e463397c7b05bd58851a364e00299cc562498"
    }
  ]
}
